{
  "bundleId": "gold",
  "asOf": "2026-09-09T16:00:00Z",
  "sourceWatermark": "hand",
  "issues": [
    {
      "id": "q-1",
      "key": "Q-1",
      "summary": "Очередь",
      "type": "Story",
      "projectKey": "CARD",
      "status": "To Do",
      "assigneeAccountId": "dev",
      "priority": "Medium",
      "storyPoints": 1,
      "storyPointsAtAdd": 1,
      "dueDate": null,
      "resolutionAt": null,
      "created": "2026-09-07T07:00:00Z",
      "labels": [],
      "parentId": null,
      "subtask": false
    }
  ],
  "statusChanges": [
    {
      "issueId": "q-1",
      "status": "To Do",
      "enteredAt": "2026-09-07T07:00:00Z",
      "exitedAt": null
    }
  ],
  "memberships": [
    {
      "issueId": "q-1",
      "sprintId": "s",
      "addedAt": "2026-09-07T06:00:00Z",
      "removedAt": null
    }
  ],
  "sprints": [
    {
      "id": "s",
      "name": "Спринт",
      "state": "active",
      "start": "2026-09-07",
      "end": "2026-09-18"
    }
  ],
  "links": []
}
